{
  "$schema": "https://json-schema.org/draft/2020-12/schema",
  "title": "DATA-001 approval manifest",
  "type": "object",
  "additionalProperties": false,
  "required": ["schema_version", "dataset_id", "draft_version", "state", "created_by", "submitted_at", "reviewed_by", "reviewed_at", "review_comment", "artifacts", "decisions"],
  "properties": {
    "schema_version": {"type": "integer", "const": 1},
    "dataset_id": {"const": "sejong-data-001"},
    "draft_version": {"type": "string", "pattern": "^0\\.1\\.0-draft\\.1$"},
    "state": {"enum": ["PENDING_PM_REVIEW", "APPROVED_FOR_INITIAL_RELEASE", "REJECTED"]},
    "created_by": {"const": "AI-DATA-BACKEND"},
    "submitted_at": {"type": ["string", "null"], "format": "date-time"},
    "reviewed_by": {"type": ["string", "null"]},
    "reviewed_at": {"type": ["string", "null"], "format": "date-time"},
    "review_comment": {"type": ["string", "null"]},
    "artifacts": {
      "type": "array",
      "minItems": 3,
      "maxItems": 3,
      "uniqueItems": true,
      "items": {
        "type": "object",
        "additionalProperties": false,
        "required": ["path", "record_count", "sha256"],
        "properties": {
          "path": {"enum": ["kb_records.json", "offices.json", "office_service_mappings.json"]},
          "record_count": {"type": "integer", "minimum": 0},
          "sha256": {"type": "string", "pattern": "^[a-f0-9]{64}$"}
        }
      }
    },
    "decisions": {
      "type": "array",
      "minItems": 35,
      "maxItems": 35,
      "items": {
        "type": "object",
        "additionalProperties": false,
        "required": ["record_type", "record_id", "recommended_decision", "decision", "comment"],
        "properties": {
          "record_type": {"enum": ["KB", "OFFICE", "MAPPING"]},
          "record_id": {"type": "string", "pattern": "^(?:KB-(?:MOVE|CERT|WASTE|TAX)-[0-9]{2}|OFFICE-(?:AREUM|DODAM|JOCHIWON)(?::(?:MOVE_IN_RESIDENT_REGISTRATION|CERTIFICATE_ISSUANCE|BULKY_WASTE|LOCAL_TAX_GENERAL))?)$"},
          "recommended_decision": {"enum": ["APPROVE_INITIAL_RELEASE", "WITHHOLD_FOR_REGRESSION", "REJECT"]},
          "decision": {"type": ["string", "null"], "enum": ["APPROVE_INITIAL_RELEASE", "WITHHOLD_FOR_REGRESSION", "REJECT", null]},
          "comment": {"type": ["string", "null"]}
        }
      }
    }
  }
}
