{
  "artifacts": [
    {
      "path": "kb_records.json",
      "record_count": 20,
      "sha256": "38d0c801b3dab3962b5cd01fe15a43a60121963b53e8b1f7ac65304d07267365"
    },
    {
      "path": "offices.json",
      "record_count": 3,
      "sha256": "fe942ce476c7d78f5b17deb10fd3b53e5b673f3ae36cf67a042823ccd51a7af0"
    },
    {
      "path": "office_service_mappings.json",
      "record_count": 12,
      "sha256": "a0fb8f3c423c0b0b199ed27cdb35cf40efa9011e7ae3d6736f420fc175ee4e1b"
    }
  ],
  "created_by": "AI-DATA-BACKEND",
  "dataset_id": "sejong-data-001",
  "decisions": [
    {
      "comment": null,
      "decision": null,
      "recommended_decision": "APPROVE_INITIAL_RELEASE",
      "record_id": "KB-CERT-01",
      "record_type": "KB"
    },
    {
      "comment": null,
      "decision": null,
      "recommended_decision": "APPROVE_INITIAL_RELEASE",
      "record_id": "KB-CERT-02",
      "record_type": "KB"
    },
    {
      "comment": null,
      "decision": null,
      "recommended_decision": "APPROVE_INITIAL_RELEASE",
      "record_id": "KB-CERT-03",
      "record_type": "KB"
    },
    {
      "comment": null,
      "decision": null,
      "recommended_decision": "APPROVE_INITIAL_RELEASE",
      "record_id": "KB-CERT-04",
      "record_type": "KB"
    },
    {
      "comment": null,
      "decision": null,
      "recommended_decision": "APPROVE_INITIAL_RELEASE",
      "record_id": "KB-CERT-05",
      "record_type": "KB"
    },
    {
      "comment": null,
      "decision": null,
      "recommended_decision": "APPROVE_INITIAL_RELEASE",
      "record_id": "KB-MOVE-01",
      "record_type": "KB"
    },
    {
      "comment": null,
      "decision": null,
      "recommended_decision": "APPROVE_INITIAL_RELEASE",
      "record_id": "KB-MOVE-02",
      "record_type": "KB"
    },
    {
      "comment": null,
      "decision": null,
      "recommended_decision": "APPROVE_INITIAL_RELEASE",
      "record_id": "KB-MOVE-03",
      "record_type": "KB"
    },
    {
      "comment": null,
      "decision": null,
      "recommended_decision": "APPROVE_INITIAL_RELEASE",
      "record_id": "KB-MOVE-04",
      "record_type": "KB"
    },
    {
      "comment": null,
      "decision": null,
      "recommended_decision": "APPROVE_INITIAL_RELEASE",
      "record_id": "KB-MOVE-05",
      "record_type": "KB"
    },
    {
      "comment": null,
      "decision": null,
      "recommended_decision": "APPROVE_INITIAL_RELEASE",
      "record_id": "KB-TAX-01",
      "record_type": "KB"
    },
    {
      "comment": null,
      "decision": null,
      "recommended_decision": "APPROVE_INITIAL_RELEASE",
      "record_id": "KB-TAX-02",
      "record_type": "KB"
    },
    {
      "comment": null,
      "decision": null,
      "recommended_decision": "APPROVE_INITIAL_RELEASE",
      "record_id": "KB-TAX-03",
      "record_type": "KB"
    },
    {
      "comment": null,
      "decision": null,
      "recommended_decision": "APPROVE_INITIAL_RELEASE",
      "record_id": "KB-TAX-04",
      "record_type": "KB"
    },
    {
      "comment": null,
      "decision": null,
      "recommended_decision": "APPROVE_INITIAL_RELEASE",
      "record_id": "KB-TAX-05",
      "record_type": "KB"
    },
    {
      "comment": null,
      "decision": null,
      "recommended_decision": "APPROVE_INITIAL_RELEASE",
      "record_id": "KB-WASTE-01",
      "record_type": "KB"
    },
    {
      "comment": null,
      "decision": null,
      "recommended_decision": "APPROVE_INITIAL_RELEASE",
      "record_id": "KB-WASTE-02",
      "record_type": "KB"
    },
    {
      "comment": null,
      "decision": null,
      "recommended_decision": "WITHHOLD_FOR_REGRESSION",
      "record_id": "KB-WASTE-03",
      "record_type": "KB"
    },
    {
      "comment": null,
      "decision": null,
      "recommended_decision": "APPROVE_INITIAL_RELEASE",
      "record_id": "KB-WASTE-04",
      "record_type": "KB"
    },
    {
      "comment": null,
      "decision": null,
      "recommended_decision": "APPROVE_INITIAL_RELEASE",
      "record_id": "KB-WASTE-05",
      "record_type": "KB"
    },
    {
      "comment": null,
      "decision": null,
      "recommended_decision": "APPROVE_INITIAL_RELEASE",
      "record_id": "OFFICE-AREUM:BULKY_WASTE",
      "record_type": "MAPPING"
    },
    {
      "comment": null,
      "decision": null,
      "recommended_decision": "APPROVE_INITIAL_RELEASE",
      "record_id": "OFFICE-AREUM:CERTIFICATE_ISSUANCE",
      "record_type": "MAPPING"
    },
    {
      "comment": null,
      "decision": null,
      "recommended_decision": "REJECT",
      "record_id": "OFFICE-AREUM:LOCAL_TAX_GENERAL",
      "record_type": "MAPPING"
    },
    {
      "comment": null,
      "decision": null,
      "recommended_decision": "APPROVE_INITIAL_RELEASE",
      "record_id": "OFFICE-AREUM:MOVE_IN_RESIDENT_REGISTRATION",
      "record_type": "MAPPING"
    },
    {
      "comment": null,
      "decision": null,
      "recommended_decision": "REJECT",
      "record_id": "OFFICE-DODAM:BULKY_WASTE",
      "record_type": "MAPPING"
    },
    {
      "comment": null,
      "decision": null,
      "recommended_decision": "APPROVE_INITIAL_RELEASE",
      "record_id": "OFFICE-DODAM:CERTIFICATE_ISSUANCE",
      "record_type": "MAPPING"
    },
    {
      "comment": null,
      "decision": null,
      "recommended_decision": "APPROVE_INITIAL_RELEASE",
      "record_id": "OFFICE-DODAM:LOCAL_TAX_GENERAL",
      "record_type": "MAPPING"
    },
    {
      "comment": null,
      "decision": null,
      "recommended_decision": "APPROVE_INITIAL_RELEASE",
      "record_id": "OFFICE-DODAM:MOVE_IN_RESIDENT_REGISTRATION",
      "record_type": "MAPPING"
    },
    {
      "comment": null,
      "decision": null,
      "recommended_decision": "APPROVE_INITIAL_RELEASE",
      "record_id": "OFFICE-JOCHIWON:BULKY_WASTE",
      "record_type": "MAPPING"
    },
    {
      "comment": null,
      "decision": null,
      "recommended_decision": "APPROVE_INITIAL_RELEASE",
      "record_id": "OFFICE-JOCHIWON:CERTIFICATE_ISSUANCE",
      "record_type": "MAPPING"
    },
    {
      "comment": null,
      "decision": null,
      "recommended_decision": "APPROVE_INITIAL_RELEASE",
      "record_id": "OFFICE-JOCHIWON:LOCAL_TAX_GENERAL",
      "record_type": "MAPPING"
    },
    {
      "comment": null,
      "decision": null,
      "recommended_decision": "APPROVE_INITIAL_RELEASE",
      "record_id": "OFFICE-JOCHIWON:MOVE_IN_RESIDENT_REGISTRATION",
      "record_type": "MAPPING"
    },
    {
      "comment": null,
      "decision": null,
      "recommended_decision": "APPROVE_INITIAL_RELEASE",
      "record_id": "OFFICE-AREUM",
      "record_type": "OFFICE"
    },
    {
      "comment": null,
      "decision": null,
      "recommended_decision": "APPROVE_INITIAL_RELEASE",
      "record_id": "OFFICE-DODAM",
      "record_type": "OFFICE"
    },
    {
      "comment": null,
      "decision": null,
      "recommended_decision": "APPROVE_INITIAL_RELEASE",
      "record_id": "OFFICE-JOCHIWON",
      "record_type": "OFFICE"
    }
  ],
  "draft_version": "0.1.0-draft.1",
  "review_comment": null,
  "reviewed_at": null,
  "reviewed_by": null,
  "schema_version": 1,
  "state": "PENDING_PM_REVIEW",
  "submitted_at": "2026-07-18T20:55:49+09:00"
}
